{
  "name": "Snake",
  "summary": "A game of Snake that plays itself across the board in colour tiles.",
  "author": { "name": "Samuel Lastrina", "github": "slastrina" },
  "tags": ["fun"],
  "version": "1.0.0",
  "license": "MIT",
  "needsSecrets": false,
  "minAppVersion": "0.8.0",
  "updated": "2026-10-22"
}
