{
  "name": "Big countdown",
  "summary": "Days to go in big colour digits, with a bar that fills up as the day gets closer.",
  "author": { "name": "Samuel Lastrina", "github": "slastrina" },
  "tags": ["calendar", "fun"],
  "version": "1.0.0",
  "license": "MIT",
  "needsSecrets": false,
  "minAppVersion": "0.8.0",
  "updated": "2026-10-19"
}
