{
  "name": "Pixel art",
  "summary": "Little pictures in colour tiles: a heart, a space invader, a rainbow, a sunset and more.",
  "author": { "name": "Samuel Lastrina", "github": "slastrina" },
  "tags": ["fun"],
  "version": "1.0.0",
  "license": "MIT",
  "needsSecrets": false,
  "minAppVersion": "0.8.0",
  "updated": "2026-10-22"
}
